005:006:001:DESCRIPTOR         1606696212.497339
 05 01 09 06 A1 01 85 01 05 07 19 E0 29 E7 15 00
 25 01 75 01 95 08 81 02 19 00 29 97 15 00 25 01
 75 01 95 98 81 02 C0 05 0C 09 01 A1 01 85 02 05
 0C 19 00 2A FF 0F 15 00 26 FF 0F 75 10 95 02 81
 00 C0 06 C0 FF 09 02 A1 01 85 03 15 00 26 FF 00
 95 3F 75 08 09 02 81 02 C0 06 C2 FF 09 03 A1 01
 85 0E 15 00 26 FF 00 95 3F 75 08 09 03 81 02 C0

005:006:000:DESCRIPTOR         1606696212.500368
 05 01 09 06 A1 01 05 07 19 E0 29 E7 15 00 25 01
 75 01 95 08 81 02 75 08 95 01 81 01 05 07 19 00
 2A FF 00 15 00 26 FF 00 75 08 95 06 81 00 05 08
 19 01 29 03 25 01 75 01 95 03 91 02 75 05 95 01
 91 01 C0

